{
    "federal_laws": [
        {
            "id": "cpeum",
            "name": "Constitución Política de los Estados Unidos Mexicanos",
            "short_name": "Constitución",
            "type": "constitucion",
            "slug": "cpeum",
            "expected_articles": 136,
            "publication_date": "1917-02-05",
            "source": "chamber",
            "url": "https://www.diputados.gob.mx/LeyesBiblio/pdf/CPEUM.pdf",
            "priority": 1,
            "tier": "constitutional",
            "status": "active",
            "category": "constitutional"
        },
        {
            "id": "amparo",
            "name": "Ley de Amparo, Reglamentaria de los Artículos 103 y 107 de la Constitución Política de los Estados Unidos Mexicanos",
            "short_name": "Ley de Amparo",
            "type": "ley",
            "slug": "amparo",
            "expected_articles": 300,
            "publication_date": "2013-04-02",
            "source": "chamber",
            "url": "https://www.diputados.gob.mx/LeyesBiblio/pdf/LAmp.pdf",
            "priority": 1,
            "tier": "constitutional",
            "status": "active",
            "category": "constitutional"
        },
        {
            "id": "lisr",
            "name": "Ley del Impuesto Sobre la Renta",
            "short_name": "Ley del ISR",
            "type": "ley",
            "slug": "lisr",
            "expected_articles": 200,
            "publication_date": "2013-12-11",
            "source": "chamber",
            "url": "https://www.diputados.gob.mx/LeyesBiblio/pdf/LISR.pdf",
            "priority": 1,
            "tier": "fiscal",
            "status": "active",
            "category": "fiscal"
        },
        {
            "id": "iva",
            "name": "Ley del Impuesto al Valor Agregado",
            "short_name": "Ley del IVA",
            "type": "ley",
            "slug": "iva",
            "expected_articles": 94,
            "publication_date": "1978-12-29",
            "source": "chamber",
            "url": "https://www.diputados.gob.mx/LeyesBiblio/pdf/LIVA.pdf",
            "priority": 1,
            "tier": "fiscal",
            "status": "active",
            "category": "fiscal"
        },
        {
            "id": "lft",
            "name": "Ley Federal del Trabajo",
            "short_name": "Ley Federal del Trabajo",
            "type": "ley",
            "slug": "lft",
            "expected_articles": 1010,
            "publication_date": "1970-04-01",
            "source": "chamber",
            "url": "https://www.diputados.gob.mx/LeyesBiblio/pdf/LFT.pdf",
            "priority": 1,
            "tier": "labor",
            "status": "active",
            "category": "labor"
        },
        {
            "id": "ccf",
            "name": "Código Civil Federal",
            "short_name": "Código Civil Federal",
            "type": "codigo",
            "slug": "ccf",
            "expected_articles": 3000,
            "publication_date": "1928-08-26",
            "source": "chamber",
            "url": "https://www.diputados.gob.mx/LeyesBiblio/pdf/CCF.pdf",
            "priority": 2,
            "tier": "civil",
            "status": "active",
            "category": "civil"
        },
        {
            "id": "lgsm",
            "name": "Ley General de Sociedades Mercantiles",
            "short_name": "Ley de Sociedades Mercantiles",
            "type": "ley",
            "slug": "lgsm",
            "expected_articles": 400,
            "publication_date": "1934-08-04",
            "source": "chamber",
            "url": "https://www.diputados.gob.mx/LeyesBiblio/pdf/LGSM.pdf",
            "priority": 2,
            "tier": "commercial",
            "status": "active",
            "category": "commercial"
        },
        {
            "id": "lgtoc",
            "name": "Ley General de Títulos y Operaciones de Crédito",
            "short_name": "Ley de Títulos y Operaciones de Crédito",
            "type": "ley",
            "slug": "lgtoc",
            "expected_articles": 400,
            "publication_date": "1932-08-27",
            "source": "chamber",
            "url": "https://www.diputados.gob.mx/LeyesBiblio/pdf/LGTOC.pdf",
            "priority": 2,
            "tier": "commercial",
            "status": "active",
            "category": "commercial"
        },
        {
            "id": "lic",
            "name": "Ley de Instituciones de Crédito",
            "short_name": "Ley de Instituciones de Crédito",
            "type": "ley",
            "slug": "lic",
            "expected_articles": 150,
            "publication_date": "1990-07-18",
            "source": "chamber",
            "url": "https://www.diputados.gob.mx/LeyesBiblio/pdf/LIC.pdf",
            "priority": 2,
            "tier": "financial",
            "status": "active",
            "category": "financial"
        },
        {
            "id": "lfpc",
            "name": "Ley Federal de Protección al Consumidor",
            "short_name": "Ley de Protección al Consumidor",
            "type": "ley",
            "slug": "lfpc",
            "expected_articles": 140,
            "publication_date": "1992-12-24",
            "source": "chamber",
            "url": "https://www.diputados.gob.mx/LeyesBiblio/pdf/LFPC.pdf",
            "priority": 2,
            "tier": "consumer",
            "status": "active",
            "category": "consumer"
        },
        {
            "id": "cff",
            "name": "Código Fiscal de la Federación",
            "short_name": "Código Fiscal",
            "type": "codigo",
            "slug": "cff",
            "expected_articles": 300,
            "publication_date": "1981-12-31",
            "source": "chamber",
            "url": "https://www.diputados.gob.mx/LeyesBiblio/pdf/CFF.pdf",
            "priority": 2,
            "tier": "fiscal",
            "status": "pending",
            "category": "fiscal"
        },
        {
            "id": "ccom",
            "name": "Código de Comercio",
            "short_name": "Código de Comercio",
            "type": "codigo",
            "slug": "ccom",
            "expected_articles": 1500,
            "publication_date": "1889-10-15",
            "source": "chamber",
            "url": "https://www.diputados.gob.mx/LeyesBiblio/pdf/CCom.pdf",
            "priority": 2,
            "tier": "commercial",
            "status": "pending",
            "category": "commercial"
        },
        {
            "id": "cnpp",
            "name": "Código Nacional de Procedimientos Penales",
            "short_name": "Código Procesal Penal",
            "type": "codigo",
            "slug": "cnpp",
            "expected_articles": 500,
            "publication_date": "2014-03-05",
            "source": "chamber",
            "url": "https://www.diputados.gob.mx/LeyesBiblio/pdf/CNPP.pdf",
            "priority": 2,
            "tier": "criminal",
            "status": "pending",
            "category": "criminal"
        },
        {
            "id": "cpf",
            "name": "Código Penal Federal",
            "short_name": "Código Penal",
            "type": "codigo",
            "slug": "cpf",
            "expected_articles": 450,
            "publication_date": "1931-08-14",
            "source": "chamber",
            "url": "https://www.diputados.gob.mx/LeyesBiblio/pdf/CPF.pdf",
            "priority": 2,
            "tier": "criminal",
            "status": "pending",
            "category": "criminal"
        },
        {
            "id": "lssi",
            "name": "Ley del Seguro Social",
            "short_name": "Ley del IMSS",
            "type": "ley",
            "slug": "lssi",
            "expected_articles": 380,
            "publication_date": "1995-12-21",
            "source": "chamber",
            "url": "https://www.diputados.gob.mx/LeyesBiblio/pdf/LSS.pdf",
            "priority": 2,
            "tier": "social_security",
            "status": "pending",
            "category": "labor"
        },
        {
            "id": "lissste",
            "name": "Ley del Instituto de Seguridad y Servicios Sociales de los Trabajadores del Estado",
            "short_name": "Ley del ISSSTE",
            "type": "ley",
            "slug": "lissste",
            "expected_articles": 250,
            "publication_date": "2007-03-31",
            "source": "chamber",
            "url": "https://www.diputados.gob.mx/LeyesBiblio/pdf/LISSSTE.pdf",
            "priority": 2,
            "tier": "social_security",
            "status": "pending",
            "category": "labor"
        },
        {
            "id": "loapf",
            "name": "Ley Orgánica de la Administración Pública Federal",
            "short_name": "LOAPF",
            "type": "ley",
            "slug": "loapf",
            "expected_articles": 80,
            "publication_date": "1976-12-29",
            "source": "chamber",
            "url": "https://www.diputados.gob.mx/LeyesBiblio/pdf/LOAPF.pdf",
            "priority": 2,
            "tier": "administrative",
            "status": "pending",
            "category": "administrative"
        },
        {
            "id": "lfra",
            "name": "Ley Federal de Responsabilidad Ambiental",
            "short_name": "Ley de Responsabilidad Ambiental",
            "type": "ley",
            "slug": "lfra",
            "expected_articles": 100,
            "publication_date": "2013-06-07",
            "source": "chamber",
            "url": "https://www.diputados.gob.mx/LeyesBiblio/pdf/LFRA.pdf",
            "priority": 2,
            "tier": "environmental",
            "status": "pending",
            "category": "environmental"
        },
        {
            "id": "lgeepa",
            "name": "Ley General del Equilibrio Ecológico y la Protección al Ambiente",
            "short_name": "LGEEPA",
            "type": "ley",
            "slug": "lgeepa",
            "expected_articles": 220,
            "publication_date": "1988-01-28",
            "source": "chamber",
            "url": "https://www.diputados.gob.mx/LeyesBiblio/pdf/LGEEPA.pdf",
            "priority": 2,
            "tier": "environmental",
            "status": "pending",
            "category": "environmental"
        },
        {
            "id": "lpjf",
            "name": "Ley Orgánica del Poder Judicial de la Federación",
            "short_name": "LOPJF",
            "type": "ley",
            "slug": "lpjf",
            "expected_articles": 200,
            "publication_date": "1995-05-26",
            "source": "chamber",
            "url": "https://www.diputados.gob.mx/LeyesBiblio/pdf/LOPJF.pdf",
            "priority": 2,
            "tier": "constitutional",
            "status": "pending",
            "category": "constitutional"
        },
        {
            "id": "lmv",
            "name": "Ley del Mercado de Valores",
            "short_name": "Ley del Mercado de Valores",
            "type": "ley",
            "slug": "lmv",
            "expected_articles": 400,
            "publication_date": "2005-12-30",
            "source": "chamber",
            "url": "https://www.diputados.gob.mx/LeyesBiblio/pdf/LMV.pdf",
            "priority": 2,
            "tier": "financial",
            "status": "pending",
            "category": "financial"
        },
        {
            "id": "lacp",
            "name": "Ley de Adquisiciones, Arrendamientos y Servicios del Sector Público",
            "short_name": "Ley de Adquisiciones Públicas",
            "type": "ley",
            "slug": "lacp",
            "expected_articles": 90,
            "publication_date": "1993-05-04",
            "source": "chamber",
            "url": "https://www.diputados.gob.mx/LeyesBiblio/pdf/LACP.pdf",
            "priority": 2,
            "tier": "administrative",
            "status": "pending",
            "category": "administrative"
        },
        {
            "id": "lfrsp",
            "name": "Ley Federal de Responsabilidades de los Servidores Públicos",
            "short_name": "Ley de Responsabilidades",
            "type": "ley",
            "slug": "lfrsp",
            "expected_articles": 110,
            "publication_date": "1982-12-31",
            "source": "chamber",
            "url": "https://www.diputados.gob.mx/LeyesBiblio/pdf/LFRSP.pdf",
            "priority": 2,
            "tier": "administrative",
            "status": "pending",
            "category": "administrative"
        },
        {
            "id": "lgipe",
            "name": "Ley General de Instituciones y Procedimientos Electorales",
            "short_name": "LGIPE",
            "type": "ley",
            "slug": "lgipe",
            "expected_articles": 500,
            "publication_date": "2014-05-23",
            "source": "chamber",
            "url": "https://www.diputados.gob.mx/LeyesBiblio/pdf/LGIPE.pdf",
            "priority": 2,
            "tier": "electoral",
            "status": "pending",
            "category": "electoral"
        },
        {
            "id": "lpi",
            "name": "Ley de la Propiedad Industrial",
            "short_name": "Ley de Propiedad Industrial",
            "type": "ley",
            "slug": "lpi",
            "expected_articles": 250,
            "publication_date": "1991-06-27",
            "source": "chamber",
            "url": "https://www.diputados.gob.mx/LeyesBiblio/pdf/LPI.pdf",
            "priority": 2,
            "tier": "intellectual_property",
            "status": "pending",
            "category": "intellectual_property"
        },
        {
            "id": "lfda",
            "name": "Ley Federal del Derecho de Autor",
            "short_name": "Ley de Derechos de Autor",
            "type": "ley",
            "slug": "lfda",
            "expected_articles": 250,
            "publication_date": "1996-12-24",
            "source": "chamber",
            "url": "https://www.diputados.gob.mx/LeyesBiblio/pdf/LFDA.pdf",
            "priority": 2,
            "tier": "intellectual_property",
            "status": "pending",
            "category": "intellectual_property"
        },
        {
            "id": "lgs",
            "name": "Ley General de Salud",
            "short_name": "Ley General de Salud",
            "type": "ley",
            "slug": "lgs",
            "expected_articles": 500,
            "publication_date": "1984-02-07",
            "source": "chamber",
            "url": "https://www.diputados.gob.mx/LeyesBiblio/pdf/LGS.pdf",
            "priority": 2,
            "tier": "health",
            "status": "pending",
            "category": "health"
        },
        {
            "id": "lge",
            "name": "Ley General de Educación",
            "short_name": "Ley General de Educación",
            "type": "ley",
            "slug": "lge",
            "expected_articles": 180,
            "publication_date": "2019-09-30",
            "source": "chamber",
            "url": "https://www.diputados.gob.mx/LeyesBiblio/pdf/LGE.pdf",
            "priority": 2,
            "tier": "education",
            "status": "pending",
            "category": "education"
        },
        {
            "id": "lgtaip",
            "name": "Ley General de Transparencia y Acceso a la Información Pública",
            "short_name": "Ley de Transparencia",
            "type": "ley",
            "slug": "lgtaip",
            "expected_articles": 220,
            "publication_date": "2015-05-04",
            "source": "chamber",
            "url": "https://www.diputados.gob.mx/LeyesBiblio/pdf/LGTAIP.pdf",
            "priority": 2,
            "tier": "transparency",
            "status": "pending",
            "category": "transparency"
        },
        {
            "id": "lgpdppso",
            "name": "Ley General de Protección de Datos Personales en Posesión de Sujetos Obligados",
            "short_name": "Ley de Protección de Datos",
            "type": "ley",
            "slug": "lgpdppso",
            "expected_articles": 130,
            "publication_date": "2017-01-26",
            "source": "chamber",
            "url": "https://www.diputados.gob.mx/LeyesBiblio/pdf/LGPDPPSO.pdf",
            "priority": 2,
            "tier": "privacy",
            "status": "pending",
            "category": "privacy"
        },
        {
            "id": "lce",
            "name": "Ley de Comercio Exterior",
            "short_name": "Ley de Comercio Exterior",
            "type": "ley",
            "slug": "lce",
            "expected_articles": 80,
            "publication_date": "1993-07-27",
            "source": "chamber",
            "url": "https://www.diputados.gob.mx/LeyesBiblio/pdf/LCE.pdf",
            "priority": 2,
            "tier": "commercial",
            "status": "pending",
            "category": "commercial"
        },
        {
            "id": "lfc",
            "name": "Ley Federal de Competencia Económica",
            "short_name": "Ley de Competencia",
            "type": "ley",
            "slug": "lfc",
            "expected_articles": 150,
            "publication_date": "2014-05-23",
            "source": "chamber",
            "url": "https://www.diputados.gob.mx/LeyesBiblio/pdf/LFCE.pdf",
            "priority": 2,
            "tier": "commercial",
            "status": "pending",
            "category": "commercial"
        },
        {
            "id": "lftaip",
            "name": "Ley Federal de Telecomunicaciones y Radiodifusión",
            "short_name": "Ley de Telecomunicaciones",
            "type": "ley",
            "slug": "lftaip",
            "expected_articles": 500,
            "publication_date": "2014-07-14",
            "source": "chamber",
            "url": "https://www.diputados.gob.mx/LeyesBiblio/pdf/LFTR.pdf",
            "priority": 2,
            "tier": "telecommunications",
            "status": "pending",
            "category": "telecommunications"
        },
        {
            "id": "lh",
            "name": "Ley de Hidrocarburos",
            "short_name": "Ley de Hidrocarburos",
            "type": "ley",
            "slug": "lh",
            "expected_articles": 130,
            "publication_date": "2014-08-11",
            "source": "chamber",
            "url": "https://www.diputados.gob.mx/LeyesBiblio/pdf/LH.pdf",
            "priority": 2,
            "tier": "energy",
            "status": "pending",
            "category": "energy"
        },
        {
            "id": "lie",
            "name": "Ley de la Industria Eléctrica",
            "short_name": "Ley de Industria Eléctrica",
            "type": "ley",
            "slug": "lie",
            "expected_articles": 150,
            "publication_date": "2014-08-11",
            "source": "chamber",
            "url": "https://www.diputados.gob.mx/LeyesBiblio/pdf/LIE.pdf",
            "priority": 2,
            "tier": "energy",
            "status": "pending",
            "category": "energy"
        },
        {
            "id": "lgsns",
            "name": "Ley General del Sistema Nacional de Seguridad Pública",
            "short_name": "Ley de Seguridad Pública",
            "type": "ley",
            "slug": "lgsns",
            "expected_articles": 200,
            "publication_date": "2009-01-02",
            "source": "chamber",
            "url": "https://www.diputados.gob.mx/LeyesBiblio/pdf/LGSNSP.pdf",
            "priority": 2,
            "tier": "security",
            "status": "pending",
            "category": "security"
        },
        {
            "id": "lgimh",
            "name": "Ley General para la Igualdad entre Mujeres y Hombres",
            "short_name": "Ley de Igualdad de Género",
            "type": "ley",
            "slug": "lgimh",
            "expected_articles": 60,
            "publication_date": "2006-08-02",
            "source": "chamber",
            "url": "https://www.diputados.gob.mx/LeyesBiblio/pdf/LGIMH.pdf",
            "priority": 2,
            "tier": "social",
            "status": "pending",
            "category": "social"
        },
        {
            "id": "lgamvlv",
            "name": "Ley General de Acceso de las Mujeres a una Vida Libre de Violencia",
            "short_name": "Ley contra Violencia de Género",
            "type": "ley",
            "slug": "lgamvlv",
            "expected_articles": 90,
            "publication_date": "2007-02-01",
            "source": "chamber",
            "url": "https://www.diputados.gob.mx/LeyesBiblio/pdf/LGAMVLV.pdf",
            "priority": 2,
            "tier": "social",
            "status": "pending",
            "category": "social"
        },
        {
            "id": "lm",
            "name": "Ley de Migración",
            "short_name": "Ley de Migración",
            "type": "ley",
            "slug": "lm",
            "expected_articles": 170,
            "publication_date": "2011-05-25",
            "source": "chamber",
            "url": "https://www.diputados.gob.mx/LeyesBiblio/pdf/LMigra.pdf",
            "priority": 2,
            "tier": "migration",
            "status": "pending",
            "category": "migration"
        },
        {
            "id": "lan",
            "name": "Ley de Aguas Nacionales",
            "short_name": "Ley de Aguas",
            "type": "ley",
            "slug": "lan",
            "expected_articles": 130,
            "publication_date": "1992-12-01",
            "source": "chamber",
            "url": "https://www.diputados.gob.mx/LeyesBiblio/pdf/LAN.pdf",
            "priority": 2,
            "tier": "environmental",
            "status": "pending",
            "category": "environmental"
        },
        {
            "id": "lda",
            "name": "Ley de Desarrollo Agrario",
            "short_name": "Ley Agraria",
            "type": "ley",
            "slug": "lda",
            "expected_articles": 200,
            "publication_date": "1992-02-26",
            "source": "chamber",
            "url": "https://www.diputados.gob.mx/LeyesBiblio/pdf/LAgra.pdf",
            "priority": 2,
            "tier": "agrarian",
            "status": "pending",
            "category": "agrarian"
        },
        {
            "id": "lbs",
            "name": "Ley de Bioseguridad de Organismos Genéticamente Modificados",
            "short_name": "Ley de Bioseguridad",
            "type": "ley",
            "slug": "lbs",
            "expected_articles": 130,
            "publication_date": "2005-03-18",
            "source": "chamber",
            "url": "https://www.diputados.gob.mx/LeyesBiblio/pdf/LBOGM.pdf",
            "priority": 2,
            "tier": "biotechnology",
            "status": "pending",
            "category": "biotechnology"
        },
        {
            "id": "lif",
            "name": "Ley de Ingresos de la Federación",
            "short_name": "Ley de Ingresos",
            "type": "ley",
            "slug": "lif",
            "expected_articles": 40,
            "publication_date": "2023-11-15",
            "source": "chamber",
            "url": "https://www.diputados.gob.mx/LeyesBiblio/pdf/LIF.pdf",
            "priority": 2,
            "tier": "fiscal",
            "status": "pending",
            "category": "fiscal"
        },
        {
            "id": "lfrfp",
            "name": "Ley Federal de Presupuesto y Responsabilidad Hacendaria",
            "short_name": "Ley de Presupuesto",
            "type": "ley",
            "slug": "lfrfp",
            "expected_articles": 120,
            "publication_date": "2006-03-30",
            "source": "chamber",
            "url": "https://www.diputados.gob.mx/LeyesBiblio/pdf/LFPRH.pdf",
            "priority": 2,
            "tier": "fiscal",
            "status": "pending",
            "category": "fiscal"
        },
        {
            "id": "lsv",
            "name": "Ley de la Silla (Reforma LFT)",
            "short_name": "Ley Silla",
            "type": "ley",
            "slug": "lsv",
            "expected_articles": 10,
            "publication_date": "2024-12-18",
            "source": "chamber",
            "url": "https://www.diputados.gob.mx/LeyesBiblio/pdf/LFT.pdf",
            "priority": 2,
            "tier": "labor",
            "status": "pending",
            "category": "labor",
            "notes": "2024 reform - worker health and rest rights"
        },
        {
            "id": "ltpd",
            "name": "Ley de Trabajadores de Plataformas Digitales (Reforma LFT)",
            "short_name": "Ley Plataformas Digitales",
            "type": "ley",
            "slug": "ltpd",
            "expected_articles": 25,
            "publication_date": "2024-12-24",
            "source": "chamber",
            "url": "https://www.diputados.gob.mx/LeyesBiblio/pdf/LFT.pdf",
            "priority": 2,
            "tier": "labor",
            "status": "pending",
            "category": "labor",
            "notes": "2024 reform - digital platform workers rights"
        },
        {
            "id": "lgpgir",
            "name": "Ley General para la Prevención y Gestión Integral de los Residuos",
            "short_name": "Ley de Residuos",
            "type": "ley",
            "slug": "lgpgir",
            "expected_articles": 180,
            "publication_date": "2003-10-08",
            "source": "chamber",
            "url": "https://www.diputados.gob.mx/LeyesBiblio/pdf/LGPGIR.pdf",
            "priority": 2,
            "tier": "environmental",
            "status": "pending",
            "category": "environmental"
        },
        {
            "id": "lgcc",
            "name": "Ley General de Cambio Climático",
            "short_name": "Ley de Cambio Climático",
            "type": "ley",
            "slug": "lgcc",
            "expected_articles": 120,
            "publication_date": "2012-06-06",
            "source": "chamber",
            "url": "https://www.diputados.gob.mx/LeyesBiblio/pdf/LGCC.pdf",
            "priority": 2,
            "tier": "environmental",
            "status": "pending",
            "category": "environmental"
        },
        {
            "id": "cjm",
            "name": "CÓDIGO de Justicia Militar \t\t\t\t \t\t\t\tDOF 31/08/1933",
            "url": "https://www.diputados.gob.mx/LeyesBiblio/pdf/CJM.pdf",
            "remote_path": "pdf/CJM.pdf",
            "priority": 3,
            "status": "discovered",
            "tier": "general",
            "category": "uncategorized",
            "short_name": "CÓDIGO de Justicia Militar \t\t\t\t \t\t\t\tDOF 31/08/1933",
            "publication_date": "1933-08-31"
        },
        {
            "id": "cfpc",
            "name": "CÓDIGO Federal de Procedimientos Civiles \t\t\t\t \t\t\t\tDOF 24/02/1943 \t\t\t\t \t\t\t\t(Abrogado en un plazo que no exceda del 01/04/2027)",
            "url": "https://www.diputados.gob.mx/LeyesBiblio/pdf/CFPC.pdf",
            "remote_path": "pdf/CFPC.pdf",
            "priority": 3,
            "status": "discovered",
            "tier": "general",
            "category": "uncategorized",
            "short_name": "CÓDIGO Federal de Procedimientos Civiles \t\t\t\t \t\t\t\t...",
            "publication_date": "1943-02-24"
        },
        {
            "id": "cmpp",
            "name": "CÓDIGO Militar de Procedimientos Penales \t\t\t\t \t\t\t\tDOF 16/05/2016 \t\t\t\t \t\t\t\tNueva reforma",
            "url": "https://www.diputados.gob.mx/LeyesBiblio/pdf/CMPP.pdf",
            "remote_path": "pdf/CMPP.pdf",
            "priority": 3,
            "status": "discovered",
            "tier": "general",
            "category": "uncategorized",
            "short_name": "CÓDIGO Militar de Procedimientos Penales \t\t\t\t \t\t\t\t...",
            "publication_date": "2016-05-16"
        },
        {
            "id": "cnpcf",
            "name": "CÓDIGO Nacional de Procedimientos Civiles y Familiares \t\t\t\t \t\t\t\tDOF 07/06/2023 \t\t\t\t \t\t\t\tNueva reforma",
            "url": "https://www.diputados.gob.mx/LeyesBiblio/pdf/CNPCF.pdf",
            "remote_path": "pdf/CNPCF.pdf",
            "priority": 3,
            "status": "discovered",
            "tier": "general",
            "category": "uncategorized",
            "short_name": "CÓDIGO Nacional de Procedimientos Civiles y Famili...",
            "publication_date": "2023-06-07"
        },
        {
            "id": "10_270614",
            "name": "ESTATUTO de Gobierno del Distrito Federal \t\t\t\t \t\t\t\tDOF 26/07/1994",
            "url": "https://www.diputados.gob.mx/LeyesBiblio/pdf/10_270614.pdf",
            "remote_path": "pdf/10_270614.pdf",
            "priority": 3,
            "status": "discovered",
            "tier": "general",
            "category": "uncategorized",
            "short_name": "ESTATUTO de Gobierno del Distrito Federal \t\t\t\t \t\t\t...",
            "publication_date": "1994-07-26"
        },
        {
            "id": "79",
            "name": "IMPUESTO sobre Servicios Expresamente Declarados de Interés Público  \t\t\t\tpor Ley, en los que Intervengan Empresas Concesionarias de Bienes  \t\t\t\tdel Dominio Directo de la Nación (LEY que establece, reforma  \t\t\t\ty adiciona las disposiciones relativas a diversos impuestos) \t\t\t\tDOF 31/12/1968",
            "url": "https://www.diputados.gob.mx/LeyesBiblio/pdf/79.pdf",
            "remote_path": "pdf/79.pdf",
            "priority": 3,
            "status": "discovered",
            "tier": "general",
            "category": "uncategorized",
            "short_name": "IMPUESTO sobre Servicios Expresamente Declarados d...",
            "publication_date": "1968-12-31"
        },
        {
            "id": "ladua",
            "name": "LEY Aduanera \t\t\t\t \t\t\t\tDOF 15/12/1995 \t\t\t\t \t\t\t\tNueva reforma",
            "url": "https://www.diputados.gob.mx/LeyesBiblio/pdf/LAdua.pdf",
            "remote_path": "pdf/LAdua.pdf",
            "priority": 3,
            "status": "discovered",
            "tier": "general",
            "category": "uncategorized",
            "short_name": "LEY Aduanera \t\t\t\t \t\t\t\tDOF 15/12/1995 \t\t\t\t \t\t\t\tNuev...",
            "publication_date": "1995-12-15"
        },
        {
            "id": "lagra",
            "name": "LEY Agraria \t\t\t\t \t\t\t\tDOF 26/02/1992 \t\t\t\t \t\t\t\tNueva reforma",
            "url": "https://www.diputados.gob.mx/LeyesBiblio/pdf/LAgra.pdf",
            "remote_path": "pdf/LAgra.pdf",
            "priority": 3,
            "status": "discovered",
            "tier": "general",
            "category": "uncategorized",
            "short_name": "LEY Agraria \t\t\t\t \t\t\t\tDOF 26/02/1992 \t\t\t\t \t\t\t\tNueva...",
            "publication_date": "1992-02-26"
        },
        {
            "id": "laassp",
            "name": "LEY de Adquisiciones, Arrendamientos y Servicios del Sector Público \t\t\t\t \t\t\t\tDOF 16/04/2025",
            "url": "https://www.diputados.gob.mx/LeyesBiblio/pdf/LAASSP.pdf",
            "remote_path": "pdf/LAASSP.pdf",
            "priority": 3,
            "status": "discovered",
            "tier": "general",
            "category": "uncategorized",
            "short_name": "LEY de Adquisiciones, Arrendamientos y Servicios d...",
            "publication_date": "2025-04-16"
        },
        {
            "id": "laero",
            "name": "LEY de Aeropuertos \t\t\t\t \t\t\t\tDOF 22/12/1995 \t\t\t\t \t\t\t\tNueva reforma",
            "url": "https://www.diputados.gob.mx/LeyesBiblio/pdf/LAero.pdf",
            "remote_path": "pdf/LAero.pdf",
            "priority": 3,
            "status": "discovered",
            "tier": "general",
            "category": "uncategorized",
            "short_name": "LEY de Aeropuertos \t\t\t\t \t\t\t\tDOF 22/12/1995 \t\t\t\t \t\t...",
            "publication_date": "1995-12-22"
        },
        {
            "id": "lamn",
            "name": "LEY de Amnistía \t\t\t\t \t\t\t\tDOF 22/04/2020",
            "url": "https://www.diputados.gob.mx/LeyesBiblio/pdf/LAmn.pdf",
            "remote_path": "pdf/LAmn.pdf",
            "priority": 3,
            "status": "discovered",
            "tier": "general",
            "category": "uncategorized",
            "short_name": "LEY de Amnistía \t\t\t\t \t\t\t\tDOF 22/04/2020",
            "publication_date": "2020-04-22"
        },
        {
            "id": "19",
            "name": "LEY de Amnistía \t\t\t\t \t\t\t\tDOF 22/01/1994",
            "url": "https://www.diputados.gob.mx/LeyesBiblio/pdf/19.pdf",
            "remote_path": "pdf/19.pdf",
            "priority": 3,
            "status": "discovered",
            "tier": "general",
            "category": "uncategorized",
            "short_name": "LEY de Amnistía \t\t\t\t \t\t\t\tDOF 22/01/1994",
            "publication_date": "1994-01-22"
        },
        {
            "id": "lamp",
            "name": "LEY de Amparo, Reglamentaria de los artículos 103 y 107 de la Constitución Política de los Estados Unidos Mexicanos \t\t\t\t \t\t\t\tDOF 02/04/2013",
            "url": "https://www.diputados.gob.mx/LeyesBiblio/pdf/LAmp.pdf",
            "remote_path": "pdf/LAmp.pdf",
            "priority": 3,
            "status": "discovered",
            "tier": "general",
            "category": "uncategorized",
            "short_name": "LEY de Amparo, Reglamentaria de los artículos 103 ...",
            "publication_date": "2013-04-02"
        },
        {
            "id": "laam",
            "name": "LEY de Ascensos de la Armada de México \t\t\t\t \t\t\t\tDOF 25/06/2004 \t\t\t\t \t\t\t\tNueva reforma",
            "url": "https://www.diputados.gob.mx/LeyesBiblio/pdf/LAAM.pdf",
            "remote_path": "pdf/LAAM.pdf",
            "priority": 3,
            "status": "discovered",
            "tier": "general",
            "category": "uncategorized",
            "short_name": "LEY de Ascensos de la Armada de México \t\t\t\t \t\t\t\tDO...",
            "publication_date": "2004-06-25"
        },
        {
            "id": "larefagn",
            "name": "LEY de Ascensos y Recompensas del Ejército, Fuerza Aérea y Guardia Nacional \t\t\t\t \t\t\t\t(Antes \"Ley de Ascensos y Recompensas del Ejército y Fuerza Aérea Mexicanos\") \t\t\t\t \t\t\t\tDOF 30/10/2003",
            "url": "https://www.diputados.gob.mx/LeyesBiblio/pdf/LAREFAGN.pdf",
            "remote_path": "pdf/LAREFAGN.pdf",
            "priority": 3,
            "status": "discovered",
            "tier": "general",
            "category": "uncategorized",
            "short_name": "LEY de Ascensos y Recompensas del Ejército, Fuerza...",
            "publication_date": "2003-10-30"
        },
        {
            "id": "lasoc",
            "name": "LEY de Asistencia Social \t\t\t\t \t\t\t\tDOF 02/09/2004",
            "url": "https://www.diputados.gob.mx/LeyesBiblio/pdf/LASoc.pdf",
            "remote_path": "pdf/LASoc.pdf",
            "priority": 3,
            "status": "discovered",
            "tier": "general",
            "category": "uncategorized",
            "short_name": "LEY de Asistencia Social \t\t\t\t \t\t\t\tDOF 02/09/2004",
            "publication_date": "2004-09-02"
        },
        {
            "id": "lapp",
            "name": "LEY de Asociaciones Público Privadas \t\t\t\t \t\t\t\tDOF 16/01/2012 \t\t\t\t \t\t\t\tNueva reforma",
            "url": "https://www.diputados.gob.mx/LeyesBiblio/pdf/LAPP.pdf",
            "remote_path": "pdf/LAPP.pdf",
            "priority": 3,
            "status": "discovered",
            "tier": "general",
            "category": "uncategorized",
            "short_name": "LEY de Asociaciones Público Privadas \t\t\t\t \t\t\t\tDOF ...",
            "publication_date": "2012-01-16"
        },
        {
            "id": "larcp",
            "name": "LEY de Asociaciones Religiosas y Culto Público \t\t\t\t \t\t\t\tDOF 15/07/1992 \t\t\t\t \t\t\t\tNueva reforma",
            "url": "https://www.diputados.gob.mx/LeyesBiblio/pdf/LARCP.pdf",
            "remote_path": "pdf/LARCP.pdf",
            "priority": 3,
            "status": "discovered",
            "tier": "general",
            "category": "uncategorized",
            "short_name": "LEY de Asociaciones Religiosas y Culto Público \t\t\t...",
            "publication_date": "1992-07-15"
        },
        {
            "id": "lac",
            "name": "LEY de Aviación Civil \t\t\t\t \t\t\t\tDOF 12/05/1995 \t\t\t\t \t\t\t\tNueva reforma",
            "url": "https://www.diputados.gob.mx/LeyesBiblio/pdf/LAC.pdf",
            "remote_path": "pdf/LAC.pdf",
            "priority": 3,
            "status": "discovered",
            "tier": "general",
            "category": "uncategorized",
            "short_name": "LEY de Aviación Civil \t\t\t\t \t\t\t\tDOF 12/05/1995 \t\t\t\t...",
            "publication_date": "1995-05-12"
        },
        {
            "id": "laat",
            "name": "LEY de Ayuda Alimentaria para los Trabajadores \t\t\t\t \t\t\t\tDOF 17/01/2011",
            "url": "https://www.diputados.gob.mx/LeyesBiblio/pdf/LAAT.pdf",
            "remote_path": "pdf/LAAT.pdf",
            "priority": 3,
            "status": "discovered",
            "tier": "general",
            "category": "uncategorized",
            "short_name": "LEY de Ayuda Alimentaria para los Trabajadores \t\t\t...",
            "publication_date": "2011-01-17"
        },
        {
            "id": "lbio",
            "name": "LEY de Biocombustibles \t\t\t\t \t\t\t\tDOF 18/03/2025",
            "url": "https://www.diputados.gob.mx/LeyesBiblio/pdf/LBio.pdf",
            "remote_path": "pdf/LBio.pdf",
            "priority": 3,
            "status": "discovered",
            "tier": "general",
            "category": "uncategorized",
            "short_name": "LEY de Biocombustibles \t\t\t\t \t\t\t\tDOF 18/03/2025",
            "publication_date": "2025-03-18"
        },
        {
            "id": "lbogm",
            "name": "LEY de Bioseguridad de Organismos Genéticamente Modificados \t\t\t\t \t\t\t\tDOF 18/03/2005",
            "url": "https://www.diputados.gob.mx/LeyesBiblio/pdf/LBOGM.pdf",
            "remote_path": "pdf/LBOGM.pdf",
            "priority": 3,
            "status": "discovered",
            "tier": "general",
            "category": "uncategorized",
            "short_name": "LEY de Bioseguridad de Organismos Genéticamente Mo...",
            "publication_date": "2005-03-18"
        },
        {
            "id": "lcec_120419",
            "name": "LEY de Cámaras Empresariales y sus Confederaciones \t\t\t\t \t\t\t\tDOF 20/01/2005",
            "url": "https://www.diputados.gob.mx/LeyesBiblio/pdf/LCEC_120419.pdf",
            "remote_path": "pdf/LCEC_120419.pdf",
            "priority": 3,
            "status": "discovered",
            "tier": "general",
            "category": "uncategorized",
            "short_name": "LEY de Cámaras Empresariales y sus Confederaciones...",
            "publication_date": "2005-01-20"
        },
        {
            "id": "lcpaf",
            "name": "LEY de Caminos, Puentes y Autotransporte Federal \t\t\t\t \t\t\t\tDOF 22/12/1993 \t\t\t\t \t\t\t\tNueva reforma",
            "url": "https://www.diputados.gob.mx/LeyesBiblio/pdf/LCPAF.pdf",
            "remote_path": "pdf/LCPAF.pdf",
            "priority": 3,
            "status": "discovered",
            "tier": "general",
            "category": "uncategorized",
            "short_name": "LEY de Caminos, Puentes y Autotransporte Federal \t...",
            "publication_date": "1993-12-22"
        },
        {
            "id": "238",
            "name": "LEY de Capitalización del Procampo \t\t\t\t \t\t\t\tDOF 31/12/2001",
            "url": "https://www.diputados.gob.mx/LeyesBiblio/pdf/238.pdf",
            "remote_path": "pdf/238.pdf",
            "priority": 3,
            "status": "discovered",
            "tier": "general",
            "category": "uncategorized",
            "short_name": "LEY de Capitalización del Procampo \t\t\t\t \t\t\t\tDOF 31...",
            "publication_date": "2001-12-31"
        },
        {
            "id": "lcjpjf",
            "name": "LEY de Carrera Judicial del Poder Judicial de la Federación \t\t\t\t \t\t\t\tDOF 02/01/2025",
            "url": "https://www.diputados.gob.mx/LeyesBiblio/pdf/LCJPJF.pdf",
            "remote_path": "pdf/LCJPJF.pdf",
            "priority": 3,
            "status": "discovered",
            "tier": "general",
            "category": "uncategorized",
            "short_name": "LEY de Carrera Judicial del Poder Judicial de la F...",
            "publication_date": "2025-01-02"
        },
        {
            "id": "28",
            "name": "LEY de Comercio Exterior \t\t\t\t \t\t\t\tDOF 27/07/1993",
            "url": "https://www.diputados.gob.mx/LeyesBiblio/pdf/28.pdf",
            "remote_path": "pdf/28.pdf",
            "priority": 3,
            "status": "discovered",
            "tier": "general",
            "category": "uncategorized",
            "short_name": "LEY de Comercio Exterior \t\t\t\t \t\t\t\tDOF 27/07/1993",
            "publication_date": "1993-07-27"
        },
        {
            "id": "lcm",
            "name": "LEY de Concursos Mercantiles \t\t\t\t \t\t\t\tDOF 12/05/2000 \t\t\t\t \t\t\t\tEn  \t\t\t\tactualización",
            "url": "https://www.diputados.gob.mx/LeyesBiblio/pdf/LCM.pdf",
            "remote_path": "pdf/LCM.pdf",
            "priority": 3,
            "status": "discovered",
            "tier": "general",
            "category": "uncategorized",
            "short_name": "LEY de Concursos Mercantiles \t\t\t\t \t\t\t\tDOF 12/05/20...",
            "publication_date": "2000-05-12"
        },
        {
            "id": "30",
            "name": "LEY de Contribución de Mejoras por Obras Públicas Federales de Infraestructura Hidráulica \t\t\t\t \t\t\t\tDOF 26/12/1990",
            "url": "https://www.diputados.gob.mx/LeyesBiblio/pdf/30.pdf",
            "remote_path": "pdf/30.pdf",
            "priority": 3,
            "status": "discovered",
            "tier": "general",
            "category": "uncategorized",
            "short_name": "LEY de Contribución de Mejoras por Obras Públicas ...",
            "publication_date": "1990-12-26"
        },
        {
            "id": "lcid_061120",
            "name": "LEY de Cooperación Internacional para el Desarrollo \t\t\t\t \t\t\t\tDOF 06/04/2011",
            "url": "https://www.diputados.gob.mx/LeyesBiblio/pdf/LCID_061120.pdf",
            "remote_path": "pdf/LCID_061120.pdf",
            "priority": 3,
            "status": "discovered",
            "tier": "general",
            "category": "uncategorized",
            "short_name": "LEY de Cooperación Internacional para el Desarroll...",
            "publication_date": "2011-04-06"
        },
        {
            "id": "lcf",
            "name": "LEY de Coordinación Fiscal \t\t\t\t \t\t\t\tDOF 27/12/1978",
            "url": "https://www.diputados.gob.mx/LeyesBiblio/pdf/LCF.pdf",
            "remote_path": "pdf/LCF.pdf",
            "priority": 3,
            "status": "discovered",
            "tier": "general",
            "category": "uncategorized",
            "short_name": "LEY de Coordinación Fiscal \t\t\t\t \t\t\t\tDOF 27/12/1978",
            "publication_date": "1978-12-27"
        },
        {
            "id": "ldrs",
            "name": "LEY de Desarrollo Rural Sustentable \t\t\t\t \t\t\t\tDOF 07/12/2001",
            "url": "https://www.diputados.gob.mx/LeyesBiblio/pdf/LDRS.pdf",
            "remote_path": "pdf/LDRS.pdf",
            "priority": 3,
            "status": "discovered",
            "tier": "general",
            "category": "uncategorized",
            "short_name": "LEY de Desarrollo Rural Sustentable \t\t\t\t \t\t\t\tDOF 0...",
            "publication_date": "2001-12-07"
        },
        {
            "id": "ldsc",
            "name": "LEY de Desarrollo Sustentable de la Cafeticultura \t\t\t\t \t\t\t\tDOF 19/12/2025 \t\t\t\t \t\t\t\tNueva Ley en  \t\t\t\tvigor 17/06/2026",
            "url": "https://www.diputados.gob.mx/LeyesBiblio/pdf/LDSC.pdf",
            "remote_path": "pdf/LDSC.pdf",
            "priority": 3,
            "status": "discovered",
            "tier": "general",
            "category": "uncategorized",
            "short_name": "LEY de Desarrollo Sustentable de la Cafeticultura ...",
            "publication_date": "2025-12-19"
        },
        {
            "id": "ldsca",
            "name": "LEY de Desarrollo Sustentable de la Caña de Azúcar \t\t\t\t \t\t\t\tDOF 22/08/2005 \t\t\t\t \t\t\t\tNueva reforma",
            "url": "https://www.diputados.gob.mx/LeyesBiblio/pdf/LDSCA.pdf",
            "remote_path": "pdf/LDSCA.pdf",
            "priority": 3,
            "status": "discovered",
            "tier": "general",
            "category": "uncategorized",
            "short_name": "LEY de Desarrollo Sustentable de la Caña de Azúcar...",
            "publication_date": "2005-08-22"
        },
        {
            "id": "ldefagn",
            "name": "LEY de Disciplina del Ejército, Fuerza Aérea y Guardia Nacional \t\t\t\t \t\t\t\t(Antes \"Ley de Disciplina del Ejército y Fuerza Aérea Mexicanos\") \t\t\t\t \t\t\t\tDOF 15/03/1926",
            "url": "https://www.diputados.gob.mx/LeyesBiblio/pdf/LDEFAGN.pdf",
            "remote_path": "pdf/LDEFAGN.pdf",
            "priority": 3,
            "status": "discovered",
            "tier": "general",
            "category": "uncategorized",
            "short_name": "LEY de Disciplina del Ejército, Fuerza Aérea y Gua...",
            "publication_date": "1926-03-15"
        },
        {
            "id": "ldfefm",
            "name": "LEY de Disciplina Financiera de las Entidades Federativas y los Municipios \t\t\t\t \t\t\t\tDOF 27/04/2016",
            "url": "https://www.diputados.gob.mx/LeyesBiblio/pdf/LDFEFM.pdf",
            "remote_path": "pdf/LDFEFM.pdf",
            "priority": 3,
            "status": "discovered",
            "tier": "general",
            "category": "uncategorized",
            "short_name": "LEY de Disciplina Financiera de las Entidades Fede...",
            "publication_date": "2016-04-27"
        },
        {
            "id": "252",
            "name": "LEY de Disciplina para el Personal de la Armada de México \t\t\t\t \t\t\t\tDOF 13/12/2002",
            "url": "https://www.diputados.gob.mx/LeyesBiblio/pdf/252.pdf",
            "remote_path": "pdf/252.pdf",
            "priority": 3,
            "status": "discovered",
            "tier": "general",
            "category": "uncategorized",
            "short_name": "LEY de Disciplina para el Personal de la Armada de...",
            "publication_date": "2002-12-13"
        },
        {
            "id": "lemefagn",
            "name": "LEY de Educación Militar del Ejército, Fuerza Aérea y Guardia Nacional \t\t\t\t \t\t\t\t(Antes \"Ley de Educación Militar del Ejército y Fuerza Aérea Mexicanos\") \t\t\t\t \t\t\t\tDOF 23/12/2005",
            "url": "https://www.diputados.gob.mx/LeyesBiblio/pdf/LEMEFAGN.pdf",
            "remote_path": "pdf/LEMEFAGN.pdf",
            "priority": 3,
            "status": "discovered",
            "tier": "general",
            "category": "uncategorized",
            "short_name": "LEY de Educación Militar del Ejército, Fuerza Aére...",
            "publication_date": "2005-12-23"
        },
        {
            "id": "len",
            "name": "LEY de Educación Naval \t\t\t\t \t\t\t\tDOF 12/03/2019",
            "url": "https://www.diputados.gob.mx/LeyesBiblio/pdf/LEN.pdf",
            "remote_path": "pdf/LEN.pdf",
            "priority": 3,
            "status": "discovered",
            "tier": "general",
            "category": "uncategorized",
            "short_name": "LEY de Educación Naval \t\t\t\t \t\t\t\tDOF 12/03/2019",
            "publication_date": "2019-03-12"
        },
        {
            "id": "246",
            "name": "LEY de Energía para el Campo \t\t\t\t \t\t\t\tDOF 30/12/2002",
            "url": "https://www.diputados.gob.mx/LeyesBiblio/pdf/246.pdf",
            "remote_path": "pdf/246.pdf",
            "priority": 3,
            "status": "discovered",
            "tier": "general",
            "category": "uncategorized",
            "short_name": "LEY de Energía para el Campo \t\t\t\t \t\t\t\tDOF 30/12/20...",
            "publication_date": "2002-12-30"
        },
        {
            "id": "35",
            "name": "LEY de Expropiación \t\t\t\t \t\t\t\tDOF 25/11/1936",
            "url": "https://www.diputados.gob.mx/LeyesBiblio/pdf/35.pdf",
            "remote_path": "pdf/35.pdf",
            "priority": 3,
            "status": "discovered",
            "tier": "general",
            "category": "uncategorized",
            "short_name": "LEY de Expropiación \t\t\t\t \t\t\t\tDOF 25/11/1936",
            "publication_date": "1936-11-25"
        },
        {
            "id": "36_200521",
            "name": "LEY de Extradición Internacional \t\t\t\t \t\t\t\tDOF 29/12/1975",
            "url": "https://www.diputados.gob.mx/LeyesBiblio/pdf/36_200521.pdf",
            "remote_path": "pdf/36_200521.pdf",
            "priority": 3,
            "status": "discovered",
            "tier": "general",
            "category": "uncategorized",
            "short_name": "LEY de Extradición Internacional \t\t\t\t \t\t\t\tDOF 29/1...",
            "publication_date": "1975-12-29"
        },
        {
            "id": "lfea",
            "name": "LEY de Firma Electrónica Avanzada \t\t\t\t \t\t\t\tDOF 11/01/2012 \t\t\t\t \t\t\t\tNueva reforma",
            "url": "https://www.diputados.gob.mx/LeyesBiblio/pdf/LFEA.pdf",
            "remote_path": "pdf/LFEA.pdf",
            "priority": 3,
            "status": "discovered",
            "tier": "general",
            "category": "uncategorized",
            "short_name": "LEY de Firma Electrónica Avanzada \t\t\t\t \t\t\t\tDOF 11/...",
            "publication_date": "2012-01-11"
        },
        {
            "id": "lfrcf_200521",
            "name": "LEY de Fiscalización y Rendición de Cuentas de la Federación \t\t\t\t \t\t\t\tDOF 18/07/2016",
            "url": "https://www.diputados.gob.mx/LeyesBiblio/pdf/LFRCF_200521.pdf",
            "remote_path": "pdf/LFRCF_200521.pdf",
            "priority": 3,
            "status": "discovered",
            "tier": "general",
            "category": "uncategorized",
            "short_name": "LEY de Fiscalización y Rendición de Cuentas de la ...",
            "publication_date": "2016-07-18"
        },
        {
            "id": "lfcc_200120",
            "name": "LEY de Fomento a la Confianza Ciudadana \t\t\t\t \t\t\t\tDOF 20/01/2020",
            "url": "https://www.diputados.gob.mx/LeyesBiblio/pdf/LFCC_200120.pdf",
            "remote_path": "pdf/LFCC_200120.pdf",
            "priority": 3,
            "status": "discovered",
            "tier": "general",
            "category": "uncategorized",
            "short_name": "LEY de Fomento a la Confianza Ciudadana \t\t\t\t \t\t\t\tD...",
            "publication_date": "2020-01-20"
        },
        {
            "id": "lfiv_230518",
            "name": "LEY de Fomento a la Industria Vitivinícola \t\t\t\t \t\t\t\tDOF 23/05/2018",
            "url": "https://www.diputados.gob.mx/LeyesBiblio/pdf/LFIV_230518.pdf",
            "remote_path": "pdf/LFIV_230518.pdf",
            "priority": 3,
            "status": "discovered",
            "tier": "general",
            "category": "uncategorized",
            "short_name": "LEY de Fomento a la Industria Vitivinícola \t\t\t\t \t\t...",
            "publication_date": "2018-05-23"
        },
        {
            "id": "lfll",
            "name": "LEY de Fomento para la Lectura y el Libro \t\t\t\t \t\t\t\tDOF 24/07/2008",
            "url": "https://www.diputados.gob.mx/LeyesBiblio/pdf/LFLL.pdf",
            "remote_path": "pdf/LFLL.pdf",
            "priority": 3,
            "status": "discovered",
            "tier": "general",
            "category": "uncategorized",
            "short_name": "LEY de Fomento para la Lectura y el Libro \t\t\t\t \t\t\t...",
            "publication_date": "2008-07-24"
        },
        {
            "id": "lfaar",
            "name": "LEY de Fondos de Aseguramiento Agropecuario y Rural \t\t\t\t \t\t\t\tDOF 13/05/2005 \t\t\t\t \t\t\t\tNueva reforma",
            "url": "https://www.diputados.gob.mx/LeyesBiblio/pdf/LFAAR.pdf",
            "remote_path": "pdf/LFAAR.pdf",
            "priority": 3,
            "status": "discovered",
            "tier": "general",
            "category": "uncategorized",
            "short_name": "LEY de Fondos de Aseguramiento Agropecuario y Rura...",
            "publication_date": "2005-05-13"
        },
        {
            "id": "lfi",
            "name": "LEY de Fondos de Inversión \t\t\t\t \t\t\t\t(Antes \"Ley de Sociedades de Inversión\") \t\t\t\t \t\t\t\tDOF 04/06/2001 \t\t\t\t \t\t\t\tNueva reforma",
            "url": "https://www.diputados.gob.mx/LeyesBiblio/pdf/LFI.pdf",
            "remote_path": "pdf/LFI.pdf",
            "priority": 3,
            "status": "discovered",
            "tier": "general",
            "category": "uncategorized",
            "short_name": "LEY de Fondos de Inversión \t\t\t\t \t\t\t\t(Antes \"Ley de...",
            "publication_date": "2001-06-04"
        },
        {
            "id": "lgeo",
            "name": "LEY de Geotermia \t\t\t\t \t\t\t\tDOF 18/03/2025",
            "url": "https://www.diputados.gob.mx/LeyesBiblio/pdf/LGeo.pdf",
            "remote_path": "pdf/LGeo.pdf",
            "priority": 3,
            "status": "discovered",
            "tier": "general",
            "category": "uncategorized",
            "short_name": "LEY de Geotermia \t\t\t\t \t\t\t\tDOF 18/03/2025",
            "publication_date": "2025-03-18"
        },
        {
            "id": "lical_010720",
            "name": "LEY de Infraestructura de la Calidad \t\t\t\t \t\t\t\tDOF 01/07/2020",
            "url": "https://www.diputados.gob.mx/LeyesBiblio/pdf/LICal_010720.pdf",
            "remote_path": "pdf/LICal_010720.pdf",
            "priority": 3,
            "status": "discovered",
            "tier": "general",
            "category": "uncategorized",
            "short_name": "LEY de Infraestructura de la Calidad \t\t\t\t \t\t\t\tDOF ...",
            "publication_date": "2020-07-01"
        },
        {
            "id": "lif_2026",
            "name": "LEY de Ingresos de la Federación para el Ejercicio Fiscal de 2026 \t\t\t\t \t\t\t\tDOF 07/11/2025 \t\t\t\t \t\t\t\tNueva Ley en  \t\t\t\tvigor a partir del 01/01/2026",
            "url": "https://www.diputados.gob.mx/LeyesBiblio/pdf/LIF_2026.pdf",
            "remote_path": "pdf/LIF_2026.pdf",
            "priority": 3,
            "status": "discovered",
            "tier": "general",
            "category": "uncategorized",
            "short_name": "LEY de Ingresos de la Federación para el Ejercicio...",
            "publication_date": "2025-11-07"
        },
        {
            "id": "lih",
            "name": "LEY de Ingresos sobre Hidrocarburos \t\t\t\t \t\t\t\tDOF 11/08/2014 \t\t\t\t \t\t\t\tNueva reforma",
            "url": "https://www.diputados.gob.mx/LeyesBiblio/pdf/LIH.pdf",
            "remote_path": "pdf/LIH.pdf",
            "priority": 3,
            "status": "discovered",
            "tier": "general",
            "category": "uncategorized",
            "short_name": "LEY de Ingresos sobre Hidrocarburos \t\t\t\t \t\t\t\tDOF 1...",
            "publication_date": "2014-08-11"
        },
        {
            "id": "lisf",
            "name": "LEY de Instituciones de Seguros y de Fianzas \t\t\t\t \t\t\t\tDOF 04/04/2013 \t\t\t\t \t\t\t\tNueva reforma",
            "url": "https://www.diputados.gob.mx/LeyesBiblio/pdf/LISF.pdf",
            "remote_path": "pdf/LISF.pdf",
            "priority": 3,
            "status": "discovered",
            "tier": "general",
            "category": "uncategorized",
            "short_name": "LEY de Instituciones de Seguros y de Fianzas \t\t\t\t ...",
            "publication_date": "2013-04-04"
        },
        {
            "id": "lansi",
            "name": "LEY de la Agencia Nacional de Seguridad Industrial y de Protección al Medio Ambiente del Sector Hidrocarburos \t\t\t\t \t\t\t\tDOF 11/08/2014",
            "url": "https://www.diputados.gob.mx/LeyesBiblio/pdf/LANSI.pdf",
            "remote_path": "pdf/LANSI.pdf",
            "priority": 3,
            "status": "discovered",
            "tier": "general",
            "category": "uncategorized",
            "short_name": "LEY de la Agencia Nacional de Seguridad Industrial...",
            "publication_date": "2014-08-11"
        },
        {
            "id": "lcmm",
            "name": "LEY de la Casa de Moneda de México \t\t\t\t \t\t\t\tDOF 20/01/1986",
            "url": "https://www.diputados.gob.mx/LeyesBiblio/pdf/LCMM.pdf",
            "remote_path": "pdf/LCMM.pdf",
            "priority": 3,
            "status": "discovered",
            "tier": "general",
            "category": "uncategorized",
            "short_name": "LEY de la Casa de Moneda de México \t\t\t\t \t\t\t\tDOF 20...",
            "publication_date": "1986-01-20"
        },
        {
            "id": "lcnbv",
            "name": "LEY de la Comisión Nacional Bancaria y de Valores \t\t\t\t \t\t\t\tDOF 28/04/1995",
            "url": "https://www.diputados.gob.mx/LeyesBiblio/pdf/LCNBV.pdf",
            "remote_path": "pdf/LCNBV.pdf",
            "priority": 3,
            "status": "discovered",
            "tier": "general",
            "category": "uncategorized",
            "short_name": "LEY de la Comisión Nacional Bancaria y de Valores ...",
            "publication_date": "1995-04-28"
        },
        {
            "id": "lcne",
            "name": "LEY de la Comisión Nacional de Energía \t\t\t\t \t\t\t\tDOF 18/03/2025",
            "url": "https://www.diputados.gob.mx/LeyesBiblio/pdf/LCNE.pdf",
            "remote_path": "pdf/LCNE.pdf",
            "priority": 3,
            "status": "discovered",
            "tier": "general",
            "category": "uncategorized",
            "short_name": "LEY de la Comisión Nacional de Energía \t\t\t\t \t\t\t\tDO...",
            "publication_date": "2025-03-18"
        },
        {
            "id": "lcndh",
            "name": "LEY de la Comisión Nacional de los Derechos Humanos \t\t\t\t \t\t\t\tDOF 29/06/1992",
            "url": "https://www.diputados.gob.mx/LeyesBiblio/pdf/LCNDH.pdf",
            "remote_path": "pdf/LCNDH.pdf",
            "priority": 3,
            "status": "discovered",
            "tier": "general",
            "category": "uncategorized",
            "short_name": "LEY de la Comisión Nacional de los Derechos Humano...",
            "publication_date": "1992-06-29"
        },
        {
            "id": "less",
            "name": "LEY de la Economía Social y Solidaria \t\t\t\t \t\t\t\t(Antes \"Ley de la Economía Social y Solidaria, Reglamentaria del Párrafo Octavo  \t\t\t\tdel Artículo 25 de la Constitución Política de los Estados Unidos Mexicanos, en lo referente al sector social de la economía\") \t\t\t\t \t\t\t\tDOF 23/05/2012",
            "url": "https://www.diputados.gob.mx/LeyesBiblio/pdf/LESS.pdf",
            "remote_path": "pdf/LESS.pdf",
            "priority": 3,
            "status": "discovered",
            "tier": "general",
            "category": "uncategorized",
            "short_name": "LEY de la Economía Social y Solidaria \t\t\t\t \t\t\t\t(An...",
            "publication_date": "2012-05-23"
        },
        {
            "id": "lepecfe",
            "name": "LEY de la Empresa Pública del Estado, Comisión Federal de Electricidad \t\t\t\t \t\t\t\tDOF 18/03/2025",
            "url": "https://www.diputados.gob.mx/LeyesBiblio/pdf/LEPECFE.pdf",
            "remote_path": "pdf/LEPECFE.pdf",
            "priority": 3,
            "status": "discovered",
            "tier": "general",
            "category": "uncategorized",
            "short_name": "LEY de la Empresa Pública del Estado, Comisión Fed...",
            "publication_date": "2025-03-18"
        },
        {
            "id": "lepepm",
            "name": "LEY de la Empresa Pública del Estado, Petróleos Mexicanos \t\t\t\t \t\t\t\tDOF 18/03/2025",
            "url": "https://www.diputados.gob.mx/LeyesBiblio/pdf/LEPEPM.pdf",
            "remote_path": "pdf/LEPEPM.pdf",
            "priority": 3,
            "status": "discovered",
            "tier": "general",
            "category": "uncategorized",
            "short_name": "LEY de la Empresa Pública del Estado, Petróleos Me...",
            "publication_date": "2025-03-18"
        },
        {
            "id": "lfgr",
            "name": "LEY de la Fiscalía General de la República \t\t\t\t \t\t\t\tDOF 20/05/2021 \t\t\t\t \t\t\t\tNueva reforma",
            "url": "https://www.diputados.gob.mx/LeyesBiblio/pdf/LFGR.pdf",
            "remote_path": "pdf/LFGR.pdf",
            "priority": 3,
            "status": "discovered",
            "tier": "general",
            "category": "uncategorized",
            "short_name": "LEY de la Fiscalía General de la República \t\t\t\t \t\t...",
            "publication_date": "2021-05-20"
        },
        {
            "id": "lgn",
            "name": "LEY de la Guardia Nacional \t\t\t\t \t\t\t\tDOF 16/07/2025",
            "url": "https://www.diputados.gob.mx/LeyesBiblio/pdf/LGN.pdf",
            "remote_path": "pdf/LGN.pdf",
            "priority": 3,
            "status": "discovered",
            "tier": "general",
            "category": "uncategorized",
            "short_name": "LEY de la Guardia Nacional \t\t\t\t \t\t\t\tDOF 16/07/2025",
            "publication_date": "2025-07-16"
        },
        {
            "id": "lpf",
            "name": "LEY de la Policía Federal \t\t\t\t \t\t\t\tDOF 01/06/2009 \t\t\t\t \t\t\t\tNueva reforma",
            "url": "https://www.diputados.gob.mx/LeyesBiblio/pdf/LPF.pdf",
            "remote_path": "pdf/LPF.pdf",
            "priority": 3,
            "status": "discovered",
            "tier": "general",
            "category": "uncategorized",
            "short_name": "LEY de la Policía Federal \t\t\t\t \t\t\t\tDOF 01/06/2009 ...",
            "publication_date": "2009-06-01"
        },
        {
            "id": "ldpam",
            "name": "LEY de los Derechos de las Personas Adultas Mayores \t\t\t\t \t\t\t\tDOF 25/06/2002",
            "url": "https://www.diputados.gob.mx/LeyesBiblio/pdf/LDPAM.pdf",
            "remote_path": "pdf/LDPAM.pdf",
            "priority": 3,
            "status": "discovered",
            "tier": "general",
            "category": "uncategorized",
            "short_name": "LEY de los Derechos de las Personas Adultas Mayore...",
            "publication_date": "2002-06-25"
        },
        {
            "id": "lhheum",
            "name": "LEY de los Husos Horarios en los Estados Unidos Mexicanos \t\t\t\t \t\t\t\tDOF 28/10/2022",
            "url": "https://www.diputados.gob.mx/LeyesBiblio/pdf/LHHEUM.pdf",
            "remote_path": "pdf/LHHEUM.pdf",
            "priority": 3,
            "status": "discovered",
            "tier": "general",
            "category": "uncategorized",
            "short_name": "LEY de los Husos Horarios en los Estados Unidos Me...",
            "publication_date": "2022-10-28"
        },
        {
            "id": "ligie_2022",
            "name": "LEY de los Impuestos Generales de Importación y de Exportación \t\t\t\t \t\t\t\tDOF 07/06/2022 \t\t\t\t \t\t\t\tEn  \t\t\t\tactualización",
            "url": "https://www.diputados.gob.mx/LeyesBiblio/pdf/LIGIE_2022.pdf",
            "remote_path": "pdf/LIGIE_2022.pdf",
            "priority": 3,
            "status": "discovered",
            "tier": "general",
            "category": "uncategorized",
            "short_name": "LEY de los Impuestos Generales de Importación y de...",
            "publication_date": "2022-06-07"
        },
        {
            "id": "lins",
            "name": "LEY de los Institutos Nacionales de Salud \t\t\t\t \t\t\t\tDOF 26/05/2000",
            "url": "https://www.diputados.gob.mx/LeyesBiblio/pdf/LINS.pdf",
            "remote_path": "pdf/LINS.pdf",
            "priority": 3,
            "status": "discovered",
            "tier": "general",
            "category": "uncategorized",
            "short_name": "LEY de los Institutos Nacionales de Salud \t\t\t\t \t\t\t...",
            "publication_date": "2000-05-26"
        },
        {
            "id": "lsar",
            "name": "LEY de los Sistemas de Ahorro para el Retiro \t\t\t\t \t\t\t\tDOF 23/05/1996 \t\t\t\t \t\t\t\tNueva reforma",
            "url": "https://www.diputados.gob.mx/LeyesBiblio/pdf/LSAR.pdf",
            "remote_path": "pdf/LSAR.pdf",
            "priority": 3,
            "status": "discovered",
            "tier": "general",
            "category": "uncategorized",
            "short_name": "LEY de los Sistemas de Ahorro para el Retiro \t\t\t\t ...",
            "publication_date": "1996-05-23"
        },
        {
            "id": "lmigra",
            "name": "LEY de Migración \t\t\t\t \t\t\t\tDOF 25/05/2011 \t\t\t\t \t\t\t\tNueva reforma",
            "url": "https://www.diputados.gob.mx/LeyesBiblio/pdf/LMigra.pdf",
            "remote_path": "pdf/LMigra.pdf",
            "priority": 3,
            "status": "discovered",
            "tier": "general",
            "category": "uncategorized",
            "short_name": "LEY de Migración \t\t\t\t \t\t\t\tDOF 25/05/2011 \t\t\t\t \t\t\t\t...",
            "publication_date": "2011-05-25"
        },
        {
            "id": "lmin",
            "name": "LEY de Minería \t\t\t\t \t\t\t\t(Antes \"Ley Minera\") \t\t\t\t \t\t\t\tDOF 26/06/1992",
            "url": "https://www.diputados.gob.mx/LeyesBiblio/pdf/LMin.pdf",
            "remote_path": "pdf/LMin.pdf",
            "priority": 3,
            "status": "discovered",
            "tier": "general",
            "category": "uncategorized",
            "short_name": "LEY de Minería \t\t\t\t \t\t\t\t(Antes \"Ley Minera\") \t\t\t\t ...",
            "publication_date": "1992-06-26"
        },
        {
            "id": "53",
            "name": "LEY de Nacionalidad \t\t\t\t \t\t\t\tDOF 23/01/1998",
            "url": "https://www.diputados.gob.mx/LeyesBiblio/pdf/53.pdf",
            "remote_path": "pdf/53.pdf",
            "priority": 3,
            "status": "discovered",
            "tier": "general",
            "category": "uncategorized",
            "short_name": "LEY de Nacionalidad \t\t\t\t \t\t\t\tDOF 23/01/1998",
            "publication_date": "1998-01-23"
        },
        {
            "id": "lncm",
            "name": "LEY de Navegación y Comercio Marítimos \t\t\t\t \t\t\t\tDOF 01/06/2006 \t\t\t\t \t\t\t\tNueva reforma",
            "url": "https://www.diputados.gob.mx/LeyesBiblio/pdf/LNCM.pdf",
            "remote_path": "pdf/LNCM.pdf",
            "priority": 3,
            "status": "discovered",
            "tier": "general",
            "category": "uncategorized",
            "short_name": "LEY de Navegación y Comercio Marítimos \t\t\t\t \t\t\t\tDO...",
            "publication_date": "2006-06-01"
        },
        {
            "id": "lopsrm",
            "name": "LEY de Obras Públicas y Servicios Relacionados con las Mismas \t\t\t\t \t\t\t\tDOF 04/01/2000 \t\t\t\t \t\t\t\tNueva reforma",
            "url": "https://www.diputados.gob.mx/LeyesBiblio/pdf/LOPSRM.pdf",
            "remote_path": "pdf/LOPSRM.pdf",
            "priority": 3,
            "status": "discovered",
            "tier": "general",
            "category": "uncategorized",
            "short_name": "LEY de Obras Públicas y Servicios Relacionados con...",
            "publication_date": "2000-01-04"
        },
        {
            "id": "57",
            "name": "LEY de Organizaciones Ganaderas \t\t\t\t \t\t\t\tDOF 06/01/1999",
            "url": "https://www.diputados.gob.mx/LeyesBiblio/pdf/57.pdf",
            "remote_path": "pdf/57.pdf",
            "priority": 3,
            "status": "discovered",
            "tier": "general",
            "category": "uncategorized",
            "short_name": "LEY de Organizaciones Ganaderas \t\t\t\t \t\t\t\tDOF 06/01...",
            "publication_date": "1999-01-06"
        },
        {
            "id": "lplan",
            "name": "LEY de Planeación \t\t\t\t \t\t\t\tDOF 05/01/1983 \t\t\t\t \t\t\t\tNueva reforma",
            "url": "https://www.diputados.gob.mx/LeyesBiblio/pdf/LPlan.pdf",
            "remote_path": "pdf/LPlan.pdf",
            "priority": 3,
            "status": "discovered",
            "tier": "general",
            "category": "uncategorized",
            "short_name": "LEY de Planeación \t\t\t\t \t\t\t\tDOF 05/01/1983 \t\t\t\t \t\t\t...",
            "publication_date": "1983-01-05"
        },
        {
            "id": "lpte",
            "name": "LEY de Planeación y Transición Energética \t\t\t\t \t\t\t\tDOF 18/03/2025",
            "url": "https://www.diputados.gob.mx/LeyesBiblio/pdf/LPTE.pdf",
            "remote_path": "pdf/LPTE.pdf",
            "priority": 3,
            "status": "discovered",
            "tier": "general",
            "category": "uncategorized",
            "short_name": "LEY de Planeación y Transición Energética \t\t\t\t \t\t\t...",
            "publication_date": "2025-03-18"
        },
        {
            "id": "lperc",
            "name": "LEY de Premios, Estímulos y Recompensas Civiles \t\t\t\t \t\t\t\tDOF 31/12/1975",
            "url": "https://www.diputados.gob.mx/LeyesBiblio/pdf/LPERC.pdf",
            "remote_path": "pdf/LPERC.pdf",
            "priority": 3,
            "status": "discovered",
            "tier": "general",
            "category": "uncategorized",
            "short_name": "LEY de Premios, Estímulos y Recompensas Civiles \t\t...",
            "publication_date": "1975-12-31"
        },
        {
            "id": "lpo",
            "name": "LEY de Productos Orgánicos \t\t\t\t \t\t\t\tDOF 07/02/2006",
            "url": "https://www.diputados.gob.mx/LeyesBiblio/pdf/LPO.pdf",
            "remote_path": "pdf/LPO.pdf",
            "priority": 3,
            "status": "discovered",
            "tier": "general",
            "category": "uncategorized",
            "short_name": "LEY de Productos Orgánicos \t\t\t\t \t\t\t\tDOF 07/02/2006",
            "publication_date": "2006-02-07"
        },
        {
            "id": "lpab",
            "name": "LEY de Protección al Ahorro Bancario \t\t\t\t \t\t\t\tDOF 19/01/1999",
            "url": "https://www.diputados.gob.mx/LeyesBiblio/pdf/LPAB.pdf",
            "remote_path": "pdf/LPAB.pdf",
            "priority": 3,
            "status": "discovered",
            "tier": "general",
            "category": "uncategorized",
            "short_name": "LEY de Protección al Ahorro Bancario \t\t\t\t \t\t\t\tDOF ...",
            "publication_date": "1999-01-19"
        },
        {
            "id": "63",
            "name": "LEY de Protección al Comercio y la Inversión de Normas Extranjeras que Contravengan el Derecho Internacional \t\t\t\t \t\t\t\tDOF 23/10/1996",
            "url": "https://www.diputados.gob.mx/LeyesBiblio/pdf/63.pdf",
            "remote_path": "pdf/63.pdf",
            "priority": 3,
            "status": "discovered",
            "tier": "general",
            "category": "uncategorized",
            "short_name": "LEY de Protección al Comercio y la Inversión de No...",
            "publication_date": "1996-10-23"
        },
        {
            "id": "lpeam",
            "name": "LEY de Protección del Espacio Aéreo Mexicano \t\t\t\t \t\t\t\tDOF 01/03/2023",
            "url": "https://www.diputados.gob.mx/LeyesBiblio/pdf/LPEAM.pdf",
            "remote_path": "pdf/LPEAM.pdf",
            "priority": 3,
            "status": "discovered",
            "tier": "general",
            "category": "uncategorized",
            "short_name": "LEY de Protección del Espacio Aéreo Mexicano \t\t\t\t ...",
            "publication_date": "2023-03-01"
        },
        {
            "id": "lpdusf",
            "name": "LEY de Protección y Defensa al Usuario de Servicios Financieros \t\t\t\t \t\t\t\tDOF 18/01/1999 \t\t\t\t \t\t\t\tNueva reforma",
            "url": "https://www.diputados.gob.mx/LeyesBiblio/pdf/LPDUSF.pdf",
            "remote_path": "pdf/LPDUSF.pdf",
            "priority": 3,
            "status": "discovered",
            "tier": "general",
            "category": "uncategorized",
            "short_name": "LEY de Protección y Defensa al Usuario de Servicio...",
            "publication_date": "1999-01-18"
        },
        {
            "id": "65_071220",
            "name": "LEY de Puertos \t\t\t\t \t\t\t\tDOF 19/07/1993",
            "url": "https://www.diputados.gob.mx/LeyesBiblio/pdf/65_071220.pdf",
            "remote_path": "pdf/65_071220.pdf",
            "priority": 3,
            "status": "discovered",
            "tier": "general",
            "category": "uncategorized",
            "short_name": "LEY de Puertos \t\t\t\t \t\t\t\tDOF 19/07/1993",
            "publication_date": "1993-07-19"
        },
        {
            "id": "lram",
            "name": "LEY de Recompensas de la Armada de México \t\t\t\t \t\t\t\tDOF 14/01/1985",
            "url": "https://www.diputados.gob.mx/LeyesBiblio/pdf/LRAM.pdf",
            "remote_path": "pdf/LRAM.pdf",
            "priority": 3,
            "status": "discovered",
            "tier": "general",
            "category": "uncategorized",
            "short_name": "LEY de Recompensas de la Armada de México \t\t\t\t \t\t\t...",
            "publication_date": "1985-01-14"
        },
        {
            "id": "lrcdn",
            "name": "LEY de Responsabilidad Civil por Daños Nucleares \t\t\t\t \t\t\t\tDOF 31/12/1974 \t\t\t\t \t\t\t\tNueva reforma",
            "url": "https://www.diputados.gob.mx/LeyesBiblio/pdf/LRCDN.pdf",
            "remote_path": "pdf/LRCDN.pdf",
            "priority": 3,
            "status": "discovered",
            "tier": "general",
            "category": "uncategorized",
            "short_name": "LEY de Responsabilidad Civil por Daños Nucleares \t...",
            "publication_date": "1974-12-31"
        },
        {
            "id": "lsint_300519",
            "name": "LEY de Seguridad Interior \t\t\t\t \t\t\t\tDOF 21/12/2017 \t\t\t\t \t\t\t\t(Declaratoria de Invalidez de la Ley DOF 30/05/2019)",
            "url": "https://www.diputados.gob.mx/LeyesBiblio/pdf/LSInt_300519.pdf",
            "remote_path": "pdf/LSInt_300519.pdf",
            "priority": 3,
            "status": "discovered",
            "tier": "general",
            "category": "uncategorized",
            "short_name": "LEY de Seguridad Interior \t\t\t\t \t\t\t\tDOF 21/12/2017 ...",
            "publication_date": "2017-12-21"
        },
        {
            "id": "lsn",
            "name": "LEY de Seguridad Nacional \t\t\t\t \t\t\t\tDOF 31/01/2005 \t\t\t\t \t\t\t\tNueva reforma",
            "url": "https://www.diputados.gob.mx/LeyesBiblio/pdf/LSN.pdf",
            "remote_path": "pdf/LSN.pdf",
            "priority": 3,
            "status": "discovered",
            "tier": "general",
            "category": "uncategorized",
            "short_name": "LEY de Seguridad Nacional \t\t\t\t \t\t\t\tDOF 31/01/2005 ...",
            "publication_date": "2005-01-31"
        },
        {
            "id": "lsp",
            "name": "LEY de Sistemas de Pagos \t\t\t\t \t\t\t\tDOF 12/12/2002 \t\t\t\t \t\t\t\tNueva reforma",
            "url": "https://www.diputados.gob.mx/LeyesBiblio/pdf/LSP.pdf",
            "remote_path": "pdf/LSP.pdf",
            "priority": 3,
            "status": "discovered",
            "tier": "general",
            "category": "uncategorized",
            "short_name": "LEY de Sistemas de Pagos \t\t\t\t \t\t\t\tDOF 12/12/2002 \t...",
            "publication_date": "2002-12-12"
        },
        {
            "id": "70",
            "name": "LEY de Sociedades de Responsabilidad Limitada de Interés Público \t\t\t\t \t\t\t\tDOF 31/08/1934",
            "url": "https://www.diputados.gob.mx/LeyesBiblio/pdf/70.pdf",
            "remote_path": "pdf/70.pdf",
            "priority": 3,
            "status": "discovered",
            "tier": "general",
            "category": "uncategorized",
            "short_name": "LEY de Sociedades de Responsabilidad Limitada de I...",
            "publication_date": "1934-08-31"
        },
        {
            "id": "71_240418",
            "name": "LEY de Sociedades de Solidaridad Social \t\t\t\t \t\t\t\tDOF 27/05/1976",
            "url": "https://www.diputados.gob.mx/LeyesBiblio/pdf/71_240418.pdf",
            "remote_path": "pdf/71_240418.pdf",
            "priority": 3,
            "status": "discovered",
            "tier": "general",
            "category": "uncategorized",
            "short_name": "LEY de Sociedades de Solidaridad Social \t\t\t\t \t\t\t\tD...",
            "publication_date": "1976-05-27"
        },
        {
            "id": "ltf",
            "name": "LEY de Tesorería de la Federación \t\t\t\t \t\t\t\tDOF 30/12/2015",
            "url": "https://www.diputados.gob.mx/LeyesBiblio/pdf/LTF.pdf",
            "remote_path": "pdf/LTF.pdf",
            "priority": 3,
            "status": "discovered",
            "tier": "general",
            "category": "uncategorized",
            "short_name": "LEY de Tesorería de la Federación \t\t\t\t \t\t\t\tDOF 30/...",
            "publication_date": "2015-12-30"
        },
        {
            "id": "256",
            "name": "LEY de Transparencia y de Fomento a la Competencia en el Crédito Garantizado \t\t\t\t \t\t\t\tDOF 30/12/2002",
            "url": "https://www.diputados.gob.mx/LeyesBiblio/pdf/256.pdf",
            "remote_path": "pdf/256.pdf",
            "priority": 3,
            "status": "discovered",
            "tier": "general",
            "category": "uncategorized",
            "short_name": "LEY de Transparencia y de Fomento a la Competencia...",
            "publication_date": "2002-12-30"
        },
        {
            "id": "luc",
            "name": "LEY de Uniones de Crédito \t\t\t\t \t\t\t\tDOF 20/08/2008 \t\t\t\t \t\t\t\tNueva reforma",
            "url": "https://www.diputados.gob.mx/LeyesBiblio/pdf/LUC.pdf",
            "remote_path": "pdf/LUC.pdf",
            "priority": 3,
            "status": "discovered",
            "tier": "general",
            "category": "uncategorized",
            "short_name": "LEY de Uniones de Crédito \t\t\t\t \t\t\t\tDOF 20/08/2008 ...",
            "publication_date": "2008-08-20"
        },
        {
            "id": "lvzmm",
            "name": "LEY de Vertimientos en las Zonas Marinas Mexicanas \t\t\t\t \t\t\t\tDOF 17/01/2014 \t\t\t\t \t\t\t\tNueva reforma",
            "url": "https://www.diputados.gob.mx/LeyesBiblio/pdf/LVZMM.pdf",
            "remote_path": "pdf/LVZMM.pdf",
            "priority": 3,
            "status": "discovered",
            "tier": "general",
            "category": "uncategorized",
            "short_name": "LEY de Vertimientos en las Zonas Marinas Mexicanas...",
            "publication_date": "2014-01-17"
        },
        {
            "id": "lvgc",
            "name": "LEY de Vías Generales de Comunicación \t\t\t\t \t\t\t\tDOF 19/02/1940 \t\t\t\t \t\t\t\tNueva reforma",
            "url": "https://www.diputados.gob.mx/LeyesBiblio/pdf/LVGC.pdf",
            "remote_path": "pdf/LVGC.pdf",
            "priority": 3,
            "status": "discovered",
            "tier": "general",
            "category": "uncategorized",
            "short_name": "LEY de Vías Generales de Comunicación \t\t\t\t \t\t\t\tDOF...",
            "publication_date": "1940-02-19"
        },
        {
            "id": "lviv",
            "name": "LEY de Vivienda \t\t\t\t \t\t\t\tDOF 27/06/2006 \t\t\t\t \t\t\t\tEn  \t\t\t\tactualización",
            "url": "https://www.diputados.gob.mx/LeyesBiblio/pdf/LViv.pdf",
            "remote_path": "pdf/LViv.pdf",
            "priority": 3,
            "status": "discovered",
            "tier": "general",
            "category": "uncategorized",
            "short_name": "LEY de Vivienda \t\t\t\t \t\t\t\tDOF 27/06/2006 \t\t\t\t \t\t\t\tE...",
            "publication_date": "2006-06-27"
        },
        {
            "id": "74",
            "name": "LEY del Banco de México \t\t\t\t \t\t\t\tDOF 23/12/1993",
            "url": "https://www.diputados.gob.mx/LeyesBiblio/pdf/74.pdf",
            "remote_path": "pdf/74.pdf",
            "priority": 3,
            "status": "discovered",
            "tier": "general",
            "category": "uncategorized",
            "short_name": "LEY del Banco de México \t\t\t\t \t\t\t\tDOF 23/12/1993",
            "publication_date": "1993-12-23"
        },
        {
            "id": "75_100619",
            "name": "LEY del Diario Oficial de la Federación y Gacetas Gubernamentales \t\t\t\t \t\t\t\tDOF 24/12/1986",
            "url": "https://www.diputados.gob.mx/LeyesBiblio/pdf/75_100619.pdf",
            "remote_path": "pdf/75_100619.pdf",
            "priority": 3,
            "status": "discovered",
            "tier": "general",
            "category": "uncategorized",
            "short_name": "LEY del Diario Oficial de la Federación y Gacetas ...",
            "publication_date": "1986-12-24"
        },
        {
            "id": "lfmped",
            "name": "LEY del Fondo Mexicano del Petróleo para la Estabilización y el Desarrollo \t\t\t\t \t\t\t\tDOF 11/08/2014",
            "url": "https://www.diputados.gob.mx/LeyesBiblio/pdf/LFMPED.pdf",
            "remote_path": "pdf/LFMPED.pdf",
            "priority": 3,
            "status": "discovered",
            "tier": "general",
            "category": "uncategorized",
            "short_name": "LEY del Fondo Mexicano del Petróleo para la Estabi...",
            "publication_date": "2014-08-11"
        },
        {
            "id": "liva",
            "name": "LEY del Impuesto al Valor Agregado \t\t\t\t \t\t\t\tDOF 29/12/1978",
            "url": "https://www.diputados.gob.mx/LeyesBiblio/pdf/LIVA.pdf",
            "remote_path": "pdf/LIVA.pdf",
            "priority": 3,
            "status": "discovered",
            "tier": "general",
            "category": "uncategorized",
            "short_name": "LEY del Impuesto al Valor Agregado \t\t\t\t \t\t\t\tDOF 29...",
            "publication_date": "1978-12-29"
        },
        {
            "id": "lieps",
            "name": "LEY del Impuesto Especial sobre Producción y Servicios \t\t\t\t \t\t\t\tDOF 30/12/1980 \t\t\t\t \t\t\t\tNueva reforma",
            "url": "https://www.diputados.gob.mx/LeyesBiblio/pdf/LIEPS.pdf",
            "remote_path": "pdf/LIEPS.pdf",
            "priority": 3,
            "status": "discovered",
            "tier": "general",
            "category": "uncategorized",
            "short_name": "LEY del Impuesto Especial sobre Producción y Servi...",
            "publication_date": "1980-12-30"
        },
        {
            "id": "lissfam",
            "name": "LEY del Instituto de Seguridad Social para las Fuerzas Armadas Mexicanas \t\t\t\t \t\t\t\tDOF 09/07/2003 \t\t\t\t \t\t\t\tEn  \t\t\t\tactualización",
            "url": "https://www.diputados.gob.mx/LeyesBiblio/pdf/LISSFAM.pdf",
            "remote_path": "pdf/LISSFAM.pdf",
            "priority": 3,
            "status": "discovered",
            "tier": "general",
            "category": "uncategorized",
            "short_name": "LEY del Instituto de Seguridad Social para las Fue...",
            "publication_date": "2003-07-09"
        },
        {
            "id": "lifnvt",
            "name": "LEY del Instituto del Fondo Nacional de la Vivienda para los Trabajadores \t\t\t\t \t\t\t\tDOF 24/04/1972",
            "url": "https://www.diputados.gob.mx/LeyesBiblio/pdf/LIFNVT.pdf",
            "remote_path": "pdf/LIFNVT.pdf",
            "priority": 3,
            "status": "discovered",
            "tier": "general",
            "category": "uncategorized",
            "short_name": "LEY del Instituto del Fondo Nacional de la Viviend...",
            "publication_date": "1972-04-24"
        },
        {
            "id": "lifnct",
            "name": "LEY del Instituto del Fondo Nacional para el Consumo de los Trabajadores \t\t\t\t \t\t\t\tDOF 24/04/2006",
            "url": "https://www.diputados.gob.mx/LeyesBiblio/pdf/LIFNCT.pdf",
            "remote_path": "pdf/LIFNCT.pdf",
            "priority": 3,
            "status": "discovered",
            "tier": "general",
            "category": "uncategorized",
            "short_name": "LEY del Instituto del Fondo Nacional para el Consu...",
            "publication_date": "2006-04-24"
        },
        {
            "id": "limj",
            "name": "LEY del Instituto Mexicano de la Juventud \t\t\t\t \t\t\t\tDOF 06/01/1999",
            "url": "https://www.diputados.gob.mx/LeyesBiblio/pdf/LIMJ.pdf",
            "remote_path": "pdf/LIMJ.pdf",
            "priority": 3,
            "status": "discovered",
            "tier": "general",
            "category": "uncategorized",
            "short_name": "LEY del Instituto Mexicano de la Juventud \t\t\t\t \t\t\t...",
            "publication_date": "1999-01-06"
        },
        {
            "id": "88_200521",
            "name": "LEY del Instituto Nacional de las Mujeres \t\t\t\t \t\t\t\tDOF 12/01/2001 \t\t\t\t \t\t\t\tLey Abrogada",
            "url": "https://www.diputados.gob.mx/LeyesBiblio/pdf/88_200521.pdf",
            "remote_path": "pdf/88_200521.pdf",
            "priority": 3,
            "status": "discovered",
            "tier": "general",
            "category": "uncategorized",
            "short_name": "LEY del Instituto Nacional de las Mujeres \t\t\t\t \t\t\t...",
            "publication_date": "2001-01-12"
        },
        {
            "id": "linpi",
            "name": "LEY del Instituto Nacional de los Pueblos Indígenas \t\t\t\t \t\t\t\tDOF 04/12/2018",
            "url": "https://www.diputados.gob.mx/LeyesBiblio/pdf/LINPI.pdf",
            "remote_path": "pdf/LINPI.pdf",
            "priority": 3,
            "status": "discovered",
            "tier": "general",
            "category": "uncategorized",
            "short_name": "LEY del Instituto Nacional de los Pueblos Indígena...",
            "publication_date": "2018-12-04"
        },
        {
            "id": "269_200521",
            "name": "LEY del Registro Público Vehicular \t\t\t\t \t\t\t\tDOF 01/09/2004",
            "url": "https://www.diputados.gob.mx/LeyesBiblio/pdf/269_200521.pdf",
            "remote_path": "pdf/269_200521.pdf",
            "priority": 3,
            "status": "discovered",
            "tier": "general",
            "category": "uncategorized",
            "short_name": "LEY del Registro Público Vehicular \t\t\t\t \t\t\t\tDOF 01...",
            "publication_date": "2004-09-01"
        },
        {
            "id": "lse",
            "name": "LEY del Sector Eléctrico \t\t\t\t \t\t\t\tDOF 18/03/2025",
            "url": "https://www.diputados.gob.mx/LeyesBiblio/pdf/LSE.pdf",
            "remote_path": "pdf/LSE.pdf",
            "priority": 3,
            "status": "discovered",
            "tier": "general",
            "category": "uncategorized",
            "short_name": "LEY del Sector Eléctrico \t\t\t\t \t\t\t\tDOF 18/03/2025",
            "publication_date": "2025-03-18"
        },
        {
            "id": "lsh",
            "name": "LEY del Sector Hidrocarburos \t\t\t\t \t\t\t\tDOF 18/03/2025",
            "url": "https://www.diputados.gob.mx/LeyesBiblio/pdf/LSH.pdf",
            "remote_path": "pdf/LSH.pdf",
            "priority": 3,
            "status": "discovered",
            "tier": "general",
            "category": "uncategorized",
            "short_name": "LEY del Sector Hidrocarburos \t\t\t\t \t\t\t\tDOF 18/03/20...",
            "publication_date": "2025-03-18"
        },
        {
            "id": "lss",
            "name": "LEY del Seguro Social \t\t\t\t \t\t\t\tDOF 21/12/1995 \t\t\t\t \t\t\t\tNueva reforma",
            "url": "https://www.diputados.gob.mx/LeyesBiblio/pdf/LSS.pdf",
            "remote_path": "pdf/LSS.pdf",
            "priority": 3,
            "status": "discovered",
            "tier": "general",
            "category": "uncategorized",
            "short_name": "LEY del Seguro Social \t\t\t\t \t\t\t\tDOF 21/12/1995 \t\t\t\t...",
            "publication_date": "1995-12-21"
        },
        {
            "id": "93_041218",
            "name": "LEY del Servicio de Administración Tributaria \t\t\t\t \t\t\t\tDOF 15/12/1995",
            "url": "https://www.diputados.gob.mx/LeyesBiblio/pdf/93_041218.pdf",
            "remote_path": "pdf/93_041218.pdf",
            "priority": 3,
            "status": "discovered",
            "tier": "general",
            "category": "uncategorized",
            "short_name": "LEY del Servicio de Administración Tributaria \t\t\t\t...",
            "publication_date": "1995-12-15"
        },
        {
            "id": "96_190418",
            "name": "LEY del Servicio Exterior Mexicano \t\t\t\t \t\t\t\tDOF 04/01/1994",
            "url": "https://www.diputados.gob.mx/LeyesBiblio/pdf/96_190418.pdf",
            "remote_path": "pdf/96_190418.pdf",
            "priority": 3,
            "status": "discovered",
            "tier": "general",
            "category": "uncategorized",
            "short_name": "LEY del Servicio Exterior Mexicano \t\t\t\t \t\t\t\tDOF 04...",
            "publication_date": "1994-01-04"
        },
        {
            "id": "lsm",
            "name": "LEY del Servicio Militar \t\t\t\t \t\t\t\tDOF 11/09/1940",
            "url": "https://www.diputados.gob.mx/LeyesBiblio/pdf/LSM.pdf",
            "remote_path": "pdf/LSM.pdf",
            "priority": 3,
            "status": "discovered",
            "tier": "general",
            "category": "uncategorized",
            "short_name": "LEY del Servicio Militar \t\t\t\t \t\t\t\tDOF 11/09/1940",
            "publication_date": "1940-09-11"
        },
        {
            "id": "lspm",
            "name": "LEY del Servicio Postal Mexicano \t\t\t\t \t\t\t\tDOF 24/12/1986",
            "url": "https://www.diputados.gob.mx/LeyesBiblio/pdf/LSPM.pdf",
            "remote_path": "pdf/LSPM.pdf",
            "priority": 3,
            "status": "discovered",
            "tier": "general",
            "category": "uncategorized",
            "short_name": "LEY del Servicio Postal Mexicano \t\t\t\t \t\t\t\tDOF 24/1...",
            "publication_date": "1986-12-24"
        },
        {
            "id": "260",
            "name": "LEY del Servicio Profesional de Carrera en la Administración Pública Federal \t\t\t\t \t\t\t\tDOF 10/04/2003",
            "url": "https://www.diputados.gob.mx/LeyesBiblio/pdf/260.pdf",
            "remote_path": "pdf/260.pdf",
            "priority": 3,
            "status": "discovered",
            "tier": "general",
            "category": "uncategorized",
            "short_name": "LEY del Servicio Profesional de Carrera en la Admi...",
            "publication_date": "2003-04-10"
        },
        {
            "id": "lsnieg",
            "name": "LEY del Sistema Nacional de Información Estadística y Geográfica \t\t\t\t \t\t\t\tDOF 16/04/2008 \t\t\t\t \t\t\t\tNueva reforma",
            "url": "https://www.diputados.gob.mx/LeyesBiblio/pdf/LSNIEG.pdf",
            "remote_path": "pdf/LSNIEG.pdf",
            "priority": 3,
            "status": "discovered",
            "tier": "general",
            "category": "uncategorized",
            "short_name": "LEY del Sistema Nacional de Información Estadístic...",
            "publication_date": "2008-04-16"
        },
        {
            "id": "lsniimsp",
            "name": "LEY del Sistema Nacional de Investigación e Inteligencia en Materia de Seguridad Pública \t\t\t\t \t\t\t\tDOF 16/07/2025",
            "url": "https://www.diputados.gob.mx/LeyesBiblio/pdf/LSNIIMSP.pdf",
            "remote_path": "pdf/LSNIIMSP.pdf",
            "priority": 3,
            "status": "discovered",
            "tier": "general",
            "category": "uncategorized",
            "short_name": "LEY del Sistema Nacional de Investigación e Inteli...",
            "publication_date": "2025-07-16"
        },
        {
            "id": "lsprem",
            "name": "LEY del Sistema Público de Radiodifusión del Estado Mexicano \t\t\t\t \t\t\t\tDOF 14/07/2014 \t\t\t\t \t\t\t\tNueva reforma",
            "url": "https://www.diputados.gob.mx/LeyesBiblio/pdf/LSPREM.pdf",
            "remote_path": "pdf/LSPREM.pdf",
            "priority": 3,
            "status": "discovered",
            "tier": "general",
            "category": "uncategorized",
            "short_name": "LEY del Sistema Público de Radiodifusión del Estad...",
            "publication_date": "2014-07-14"
        },
        {
            "id": "lmtr",
            "name": "LEY en Materia de Telecomunicaciones y Radiodifusión \t\t\t\t \t\t\t\tDOF 16/07/2025",
            "url": "https://www.diputados.gob.mx/LeyesBiblio/pdf/LMTR.pdf",
            "remote_path": "pdf/LMTR.pdf",
            "priority": 3,
            "status": "discovered",
            "tier": "general",
            "category": "uncategorized",
            "short_name": "LEY en Materia de Telecomunicaciones y Radiodifusi...",
            "publication_date": "2025-07-16"
        },
        {
            "id": "lfcdo",
            "name": "LEY Federal contra la Delincuencia Organizada \t\t\t\t \t\t\t\tDOF 07/11/1996 \t\t\t\t \t\t\t\tNueva reforma",
            "url": "https://www.diputados.gob.mx/LeyesBiblio/pdf/LFCDO.pdf",
            "remote_path": "pdf/LFCDO.pdf",
            "priority": 3,
            "status": "discovered",
            "tier": "general",
            "category": "uncategorized",
            "short_name": "LEY Federal contra la Delincuencia Organizada \t\t\t\t...",
            "publication_date": "1996-11-07"
        },
        {
            "id": "lfafe",
            "name": "LEY Federal de Armas de Fuego y Explosivos \t\t\t\t \t\t\t\tDOF 11/01/1972",
            "url": "https://www.diputados.gob.mx/LeyesBiblio/pdf/LFAFE.pdf",
            "remote_path": "pdf/LFAFE.pdf",
            "priority": 3,
            "status": "discovered",
            "tier": "general",
            "category": "uncategorized",
            "short_name": "LEY Federal de Armas de Fuego y Explosivos \t\t\t\t \t\t...",
            "publication_date": "1972-01-11"
        },
        {
            "id": "lfar",
            "name": "LEY Federal de Austeridad Republicana \t\t\t\t \t\t\t\tDOF 19/11/2019",
            "url": "https://www.diputados.gob.mx/LeyesBiblio/pdf/LFAR.pdf",
            "remote_path": "pdf/LFAR.pdf",
            "priority": 3,
            "status": "discovered",
            "tier": "general",
            "category": "uncategorized",
            "short_name": "LEY Federal de Austeridad Republicana \t\t\t\t \t\t\t\tDOF...",
            "publication_date": "2019-11-19"
        },
        {
            "id": "103_220321",
            "name": "LEY Federal de Cinematografía \t\t\t\t \t\t\t\tDOF 29/12/1992",
            "url": "https://www.diputados.gob.mx/LeyesBiblio/pdf/103_220321.pdf",
            "remote_path": "pdf/103_220321.pdf",
            "priority": 3,
            "status": "discovered",
            "tier": "general",
            "category": "uncategorized",
            "short_name": "LEY Federal de Cinematografía \t\t\t\t \t\t\t\tDOF 29/12/1...",
            "publication_date": "1992-12-29"
        },
        {
            "id": "lfce",
            "name": "LEY Federal de Competencia Económica \t\t\t\t \t\t\t\tDOF 23/05/2014 \t\t\t\t \t\t\t\tNueva reforma",
            "url": "https://www.diputados.gob.mx/LeyesBiblio/pdf/LFCE.pdf",
            "remote_path": "pdf/LFCE.pdf",
            "priority": 3,
            "status": "discovered",
            "tier": "general",
            "category": "uncategorized",
            "short_name": "LEY Federal de Competencia Económica \t\t\t\t \t\t\t\tDOF ...",
            "publication_date": "2014-05-23"
        },
        {
            "id": "lfcpo_190521",
            "name": "LEY Federal de Consulta Popular \t\t\t\t \t\t\t\tDOF 14/03/2014",
            "url": "https://www.diputados.gob.mx/LeyesBiblio/pdf/LFCPo_190521.pdf",
            "remote_path": "pdf/LFCPo_190521.pdf",
            "priority": 3,
            "status": "discovered",
            "tier": "general",
            "category": "uncategorized",
            "short_name": "LEY Federal de Consulta Popular \t\t\t\t \t\t\t\tDOF 14/03...",
            "publication_date": "2014-03-14"
        },
        {
            "id": "105",
            "name": "LEY Federal de Correduría Pública \t\t\t\t \t\t\t\tDOF 29/12/1992",
            "url": "https://www.diputados.gob.mx/LeyesBiblio/pdf/105.pdf",
            "remote_path": "pdf/105.pdf",
            "priority": 3,
            "status": "discovered",
            "tier": "general",
            "category": "uncategorized",
            "short_name": "LEY Federal de Correduría Pública \t\t\t\t \t\t\t\tDOF 29/...",
            "publication_date": "1992-12-29"
        },
        {
            "id": "lfdeapd",
            "name": "LEY Federal de Declaración Especial de Ausencia para Personas Desaparecidas \t\t\t \t\t\tDOF 22/06/2018",
            "url": "https://www.diputados.gob.mx/LeyesBiblio/pdf/LFDEAPD.pdf",
            "remote_path": "pdf/LFDEAPD.pdf",
            "priority": 3,
            "status": "discovered",
            "tier": "general",
            "category": "uncategorized",
            "short_name": "LEY Federal de Declaración Especial de Ausencia pa...",
            "publication_date": "2018-06-22"
        },
        {
            "id": "lfdefp",
            "name": "LEY Federal de Defensoría Pública \t\t\t\t \t\t\t\tDOF 28/05/1998",
            "url": "https://www.diputados.gob.mx/LeyesBiblio/pdf/LFDefP.pdf",
            "remote_path": "pdf/LFDefP.pdf",
            "priority": 3,
            "status": "discovered",
            "tier": "general",
            "category": "uncategorized",
            "short_name": "LEY Federal de Defensoría Pública \t\t\t\t \t\t\t\tDOF 28/...",
            "publication_date": "1998-05-28"
        },
        {
            "id": "lfd",
            "name": "LEY Federal de Derechos \t\t\t\t \t\t\t\tDOF 31/12/1981 \t\t\t\t \t\t\t\tEn  \t\t\t\tactualización",
            "url": "https://www.diputados.gob.mx/LeyesBiblio/pdf/LFD.pdf",
            "remote_path": "pdf/LFD.pdf",
            "priority": 3,
            "status": "discovered",
            "tier": "general",
            "category": "uncategorized",
            "short_name": "LEY Federal de Derechos \t\t\t\t \t\t\t\tDOF 31/12/1981 \t\t...",
            "publication_date": "1981-12-31"
        },
        {
            "id": "136_300118",
            "name": "LEY Federal de Deuda Pública \t\t\t\t \t\t\t\t(Antes \"Ley General de Deuda Pública\") \t\t\t\t \t\t\t\tDOF 31/12/1976",
            "url": "https://www.diputados.gob.mx/LeyesBiblio/pdf/136_300118.pdf",
            "remote_path": "pdf/136_300118.pdf",
            "priority": 3,
            "status": "discovered",
            "tier": "general",
            "category": "uncategorized",
            "short_name": "LEY Federal de Deuda Pública \t\t\t\t \t\t\t\t(Antes \"Ley ...",
            "publication_date": "1976-12-31"
        },
        {
